test_id,gene,perturbation_type,gene_modifier,exogenous_node,exogenous_value,comparison_baseline,phenotype_node,expected_direction,expected_magnitude,doi,paper_title,authors,year,journal,evidence_sentence,verification,evidence_quality,species,notes
T001,BRC1,knockout,,,,WT,Shoot_Branching,increased,strong,,,,,,brc1 mutants had a significantly higher number of rosette branches than wild-type plants,,,,
T002,BRC2,knockout,,,,WT,Shoot_Branching,increased,moderate,,,,,,The phenotype of brc2 mutants was weaker but consistently affected RI and RII,,,,
T003,BRC1 BRC2,double_knockout,,,,WT,Shoot_Branching,increased,strong,,,,,,Double mutants brc1-2 brc2-1 had a phenotype similar to that of strong brc1 mutants,,,,
T004,MAX1,knockout,,,,WT,Shoot_Branching,increased,strong,,,,,,The four max mutants have an excess of branch outgrowth,,,,
T005,MAX2,knockout,,,,WT,Shoot_Branching,increased,strong,,,,,,The four max mutants have an excess of branch outgrowth,,,,
T006,MAX3 (CCD7),knockout,,,,WT,Shoot_Branching,increased,strong,,,,,,max3 and max4 shoots increased axillary branching,,,,
T007,MAX4 (CCD8),knockout,,,,WT,Shoot_Branching,increased,strong,,,,,,max4 mutants more rosette branches than wild-type,,,,
T008,D14,knockout,,,,WT,Shoot_Branching,increased,strong,,,,,,Significantly larger number of primary rosette branches than the wild type,,,,
T009,D27,knockout,,,,WT,Shoot_Branching,increased,strong,,,,,,d27-1 similar effects in stem as other SL biosynthesis mutants,,,,
T010,LBO,knockout,,,,WT,Shoot_Branching,increased,strong,,,,,,Homozygous mutant plants exhibited increased rosette branches compared with their respective WTs,,,,
T011,SMXL6,knockout,,,,WT,Shoot_Branching,unchanged,moderate,,,,,,smxl single mutants displayed similar phenotypes to wild type,,,,
T012,SMXL7,knockout,,,,WT,Shoot_Branching,unchanged,moderate,,,,,,smxl single mutants displayed similar phenotypes to wild type,,,,
T013,SMXL8,knockout,,,,WT,Shoot_Branching,unchanged,moderate,,,,,,smxl single mutants displayed similar phenotypes to wild type,,,,
T014,SMXL6 SMXL7 SMXL8,triple_knockout,,,,WT,Shoot_Branching,decreased,strong,,,,,,Triple mutant smxl6/7/8 displayed a significant decrease in secondary cauline branch number,,,,
T015,PHYB,knockout,,,,WT,Shoot_Branching,decreased,moderate,,,,,,Loss of phyB function resulted in a reduction in branches,,,,
T016,AXR1,knockout,,,,WT,Shoot_Branching,increased,moderate,,,,,,Phenotypes conferred by axr1 include increased branching,,,,
T017,NCED3,knockout,,,,WT,Shoot_Branching,increased,moderate,,,,,,The frequency of bud n-2 outgrowth was elevated in nced3-2 compared with the wild type,,,,
T018,ABA2,knockout,,,,WT,Shoot_Branching,increased,moderate,,,,,,The frequency of bud n-2 outgrowth was elevated in aba2-1 compared with the wild type,,,,
T019,LAS,knockout,,,,WT,Shoot_Branching,decreased,strong,,,,,,las mutants showed almost complete suppression of secondary bolt formation from rosette leaf axils,,,,
T020,RAX1,knockout,,,,WT,Shoot_Branching,decreased,moderate,,,,,,Homozygous rax1-2 plants produced fewer paraclades from rosette and cauline leaf axils,,,,
T021,TIE1,overexpression,,,,WT,Shoot_Branching,increased,strong,,,,,,All three TIE1 overexpression lines produced more branches than wild-type controls,,,,
T022,FHY3,knockout,,,,WT,Shoot_Branching,decreased,strong,,,,,,fhy3-11 had less branches compared with WT (only 16.4% of WT),,,,
T023,FHY3,overexpression,,,,WT,Shoot_Branching,increased,moderate,,,,,,FHY3-OE plants had 27.3% more rosette branches than WT,,,,
T024,FAR1,knockout,,,,WT,Shoot_Branching,decreased,strong,,,,,,far1-4 had less branches compared with WT (13.4% of WT),,,,
T025,SPL9 SPL15,double_knockout,,,,WT,Shoot_Branching,increased,moderate,,,,,,spl9 spl15 double mutant had more rosette branches than WT (~39% more),,,,
T026,SPL9 (rSPL9 miR156-resistant),overexpression,,,,WT,Shoot_Branching,decreased,moderate,,,,,,rSPL9-OE had less rosette branches than WT (~72.4% of WT),,,,
T027,BRC1,overexpression,,,,WT,Shoot_Branching,decreased,strong,,,,,,Plants expressing GFP:BRC1 showed pleiotropic developmental defects and retarded growth,,,,
T028,AMP1,knockout,,,,WT,Shoot_Branching,increased,moderate,,,,,,amp1 mutants form extra buds (elevated CK levels),,,,
T029,YUCCA1,overexpression,,,,WT,Shoot_Branching,decreased,strong,,,,,,ycc1 mutants had most rosette leaf buds arrested,,,,
T030,HB21 HB40 HB53,triple_knockout,,,,WT,Shoot_Branching,increased,moderate,,,,,,hb21 hb40 hb53 triple mutants had 79% and 90% reduced response to W+FR,,,,
T031,ARR1,knockout,,,,WT,Shoot_Branching,increased,slight,,,,,,arr1 single mutant has increased branching forming mean 6.8 rosette branches compared with 5.5,,,,
T032,PIN3 PIN4 PIN7,triple_knockout,,,,WT,Shoot_Branching,decreased,moderate,,,,,,"pin3,4,7 triple mutant forms fewer branches",,,,
T033,IPT3 IPT5 IPT7,triple_knockout,,,,WT,Shoot_Branching,decreased,moderate,,,,,,"ipt3,5,7 mutants have reduced CK levels and form fewer branches",,,,
T034,BES1,knockdown,,,,WT,Shoot_Branching,decreased,moderate,,,,,,BES1-RNAi line showed decreased branch number compared with wild type,,,,
T035,BES1,gain_of_function,,,,WT,Shoot_Branching,increased,moderate,,,,,,bes1-D mutant exhibiting more branching number,,,,
T036,FT,knockout,,,,WT,Shoot_Branching,decreased,strong,,,,,,ft mutant has almost no rosette branches,,,,
T037,FT,overexpression,,,,WT,Shoot_Branching,increased,moderate,,,,,,35S:FT plants show increase in R1 rosette branches,,,,
T038,KAI2,knockout,,,,WT,Shoot_Branching,unchanged,moderate,,,,,,No clear phenotypic similarities between max4-5 and kai2-2 for branching,,,,
T039,SMAX1,knockout,,,,WT,Shoot_Branching,unchanged,moderate,,,,,,Not significantly different from wild type for branching,,,,
T040,SPS (SUPERSHOOT),knockout,,,,WT,Shoot_Branching,increased,strong,,,,,,sps mutant has massive shoot overproliferation,,,,
T041,D14 BRC1,double_knockout,,,,WT,Shoot_Branching,increased,strong,,,,,,"d14 brc1 double mutants had significantly more branches than the single mutants, indicating additivity",,,,
T042,BRC1 MAX4,double_knockout,,,,WT,Shoot_Branching,increased,strong,,,,,,The phenotype of max brc1 double mutants is similar to those of the single max and brc1 mutant parents,,,,
T043,AXR1 MAX2,double_knockout,,,,WT,Shoot_Branching,increased,strong,,,,,,Additive bud auxin-insensitivity and branching phenotype relative to single mutants,,,,
T044,AXR1 MAX1,double_knockout,,,,WT,Shoot_Branching,increased,strong,,,,,,Double mutant exceeded that from both single mutants,,,,
T045,PHYB BRC1,double_knockout,,,,WT,Shoot_Branching,increased,strong,,,,,,brc1-2 completely suppressed phyB phenotype of reduced branching,,,,
T046,PIN1 D14,double_knockout,,,,WT,Shoot_Branching,decreased,strong,,,,,,pin1-613 d14-1 dramatically reduced shoot branching,,,,
T047,MAX2 PIN3 PIN4 PIN7,quadruple_knockout,,,,WT,Shoot_Branching,increased,moderate,,,,,,Loss of PIN347 in max2 mutants significantly reduced shoot branching vs max2 alone,,,,
T048,ABCB19,knockout,,,,WT,Shoot_Branching,decreased,slight,,,,,,Branching in abcb19 mutants was reduced compared to wild type in short days,,,,
T049,SMXL6 (degradation-resistant),overexpression,,,,WT,Shoot_Branching,increased,strong,,,,,,35S:SMXL6D-GFP plants formed more primary rosette branches and secondary cauline branches,,,,
T050,GR24 (SL analog),exogenous_SL,,,,WT,Shoot_Branching,decreased,moderate,,,,,,"GR24 can restore branching inhibition in max1, max3, and max4 mutants",,,,
T051,Cytokinin (BA),treatment,,,,WT,Shoot_Branching,increased,moderate,,,,,,Basal BA could overcome inhibitory effect of apical NAA and activate buds,,,,
T052,Decapitation,treatment,,,,WT,Shoot_Branching,increased,strong,,,,,,"Removal of the shoot apex alleviates inhibition, allowing outgrowth of lateral buds",,,,
T053,Low R:FR (shade),environmental,,,,WT,Shoot_Branching,decreased,moderate,,,,,,W+FR treatment caused 3-fold fewer branches in WT,,,,
T054,Low nitrogen (1.8 mM),environmental,,,,WT,Shoot_Branching,decreased,moderate,,,,,,Mean total number of secondary shoots dropped from 4.25 on 9 mM to 2.9 on 1.8 mM NO3-,,,,
T055,High nitrogen (9 mM),environmental,,,,WT,Shoot_Branching,increased,moderate,,,,,,Mean total number of secondary shoots produced was 4.25 on 9 mM NO3-,,,,
T056,ABA,treatment,,,,mutant,Shoot_Branching,decreased,moderate,,,,,,ABA application led to further reduction in branch number in WT,,,,
T057,GR24 on max2,knockout_plus_GR24,,,,mutant,Shoot_Branching,unchanged,strong,,,,,,Branching was unchanged in max2-1 after GR24 application,,,,
T058,GR24 on max4,knockout_plus_GR24,,,,WT,Shoot_Branching,decreased,moderate,,,,,,GR24 can restore branching inhibition in max4 mutants,,,,
T059,GR24 on brc1 brc2,knockout_plus_GR24,,,,mutant,Shoot_Branching,unchanged,moderate,,,,,,brc1brc2 plants produced fewer branches on GR24 but still more than WT,,,,
T060,CKX,overexpression,,,,WT,Shoot_Branching,decreased,moderate,,,,,,Reduction of CK levels by overexpressing cytokinin oxidase results in reduced meristem size,,,,
T061,REV/IFL1,knockout,,,,WT,Shoot_Branching,decreased,moderate,,,,,,"In the mutants ifl1, both affected in AM initiation, BRC1 and BRC2 levels were reduced",,,,
T062,DELLA quintuple,quintuple_knockout,,,,WT,Shoot_Branching,unchanged,moderate,,,,,,No statistically significant difference in total branches,,,,
T063,SMXL6 SMXL7 SMXL8 MAX2,quadruple_knockout,,,,WT,Shoot_Branching,unchanged,moderate,,,,,,Fully suppress max2 branching phenotype to wild type levels,,,,
T064,SMXL6 SMXL7 SMXL8 MAX3,quadruple_knockout,,,,WT,Shoot_Branching,decreased,strong,,,,,,max3-9 smxl6/7/8 completely suppressed max3-9 branching,,,,
T065,SMXL6 SMXL7 SMXL8 SPL9 SPL15,quintuple_knockout,,,,WT,Shoot_Branching,increased,moderate,,,,,,smxl6/7/8/spl9/15 quintuple mutant had similar number as spl9 spl15 double mutant,,,,
T066,Auxin (NAA apical),treatment,,,,WT,Shoot_Branching,decreased,strong,,,,,,NAA prevented bud outgrowth compared with lanolin-only controls,,,,
T067,Sucrose (exogenous),treatment,,,,WT,Shoot_Branching,increased,moderate,,,,,,Sucrose and hexoses induced branching and lateral bud elongation,,,, | Cross-species: Sucrose (exogenous)/
T068,EOD-FR on fhy3 far1,environmental,,,,WT,Shoot_Branching,decreased,moderate,,,,,,fhy3 far1 ~27% reduction vs 51% for WT (less sensitive to shade),,,,
T069,D14 KAI2,double_knockout,,,,WT,Shoot_Branching,increased,strong,,,,,,d14-1 kai2-2 double mutant phenocopies max2-1,,,,
T070,D14 MAX2,double_knockout,,,,WT,Shoot_Branching,increased,strong,,,,,,d14-seto max2-1 double mutants phenotype resembled that of max2-1 plants,,,,
T071,BRC1 AMP1,double_knockout,,,,WT,Shoot_Branching,increased,strong,,,,,,amp1 brc1 double mutants had a higher number of RI branches than the parental lines,,,,
T072,BRC1 YUCCA1,double_mutant,,,,WT,Shoot_Branching,increased,moderate,,,,,,brc1 mutations mostly suppressed the strong apical dominance phenotype of ycc1,,,,
T073,GN (GNOM),knockout,,,,WT,Shoot_Branching,increased,moderate,,,,,,"For gn, reduced PM PIN1 was associated with reduced auxin transport and increased shoot branching",,,,
T074,TIR3,knockout,,,,WT,Shoot_Branching,increased,moderate,,,,,,"For tir3, reduced PM PIN1 was associated with increased shoot branching",,,,
T075,SMXL7 (degradation-resistant SMXL7-D),gain_of_function,,,,WT,Shoot_Branching,increased,strong,,,,,,SMXL7-D exhibit increased branching number compared with wild-type,,,,
T076,SMXL6 SMXL7 SMXL8 BRC1,quadruple_knockout,,,,WT,Shoot_Branching,increased,strong,,,,,,brc1 was able to rescue branching phenotypes of smxl6/7/8,,,,
T077,ERA1,knockout,,,,WT,Shoot_Branching,decreased,moderate,,,,,,Arabidopsis era1 (ENHANCED RESPONSE TO ABA 1) mutant has reduced branching,,,,
T078,TIE1,loss_of_function,,,,WT,Shoot_Branching,decreased,moderate,,,,,,TIE1mEAR-VP16 dominant-negative plants produced fewer branches than controls,,,,
T079,TIE1,gain_of_function,,,,WT,Shoot_Branching,increased,strong,,,,,,tie1-D activation-tagging mutant produced an excessive number of branches,,,,
T080,MAX4 BRC1 BRC2,triple_knockout,,,,WT,Shoot_Branching,increased,strong,,,,,,Triple mutants had considerably more branches than either parent,,,,
T081,D14 BRC1 BRC2,triple_knockout,,,,WT,Shoot_Branching,increased,strong,,,,,,Triple mutants had considerably more branches than either parent,,,,
T082,MAX2 ABCB19,double_knockout,,,,WT,Shoot_Branching,increased,moderate,,,,,,Loss of ABCB19 reduced branching levels in max2 mutants,,,,
T083,BRC1 BRC2 ABCB19,triple_knockout,,,,WT,Shoot_Branching,increased,moderate,,,,,,Loss of ABCB19 significantly reduced branching in brc1brc2,,,,
T084,HB21,knockout,,,,WT,Shoot_Branching,increased,moderate,,,,,,Single hb21 mutants similar to wild-type plants in W light,,,,
T085,HB21 HB40,double_knockout,,,,WT,Shoot_Branching,increased,moderate,,,,,,hb21 hb40 double mutants had 62% reduced response to W+FR light,,,,
T086,PHYB PHYD,double_knockout,,,,WT,Shoot_Branching,decreased,moderate,,,,,,phyB phyD had enhanced branch suppression vs phyB single mutants,,,,
T087,BDL/IAA12,gain_of_function,,,,WT,Shoot_Branching,increased,moderate,,,,,,"Moderately shorter stature and increased branching, resembled max mutants",,,,
T088,NPA (auxin transport inhibitor),chemical_treatment,,,,WT,Shoot_Branching,decreased,slight,,,,,,Significant reductions in branching observed in plants treated with NPA,,,,
T089,"otsA (TPS overexpression, high T6P)",overexpression,,,,WT,Shoot_Branching,increased,strong,,,,,,35S:otsA plants had highly branched inflorescences,,,,
T090,"otsB (TPP overexpression, low T6P)",overexpression,,,,WT,Shoot_Branching,decreased,moderate,,,,,,35S:otsB plants had few branches,,,,
T091,SMXL6 SMXL7,double_knockout,,,,WT,Shoot_Branching,unchanged,moderate,,,,,,Double mutants smxl6/7 partially repressed the highly branched phenotype of max3-9,,,,
T092,SOC1,knockout,,,,WT,Shoot_Branching,decreased,moderate,,,,,,soc1 mutants show decrease in R1,,,,
T093,"ARR type-A hextuple (arr3,4,5,6,7,15)",knockout,,,,WT,Shoot_Branching,decreased,moderate,,,,,,"Hextuple type-A arr3,4,5,6,7,15 mutant exhibits reduced bud activation",,,,
T094,Phosphate deficiency,environmental,,,,WT,Shoot_Branching,decreased,moderate,,,,,,Limited availability of P promotes SL production and inhibits branching,,,,
T095,RAX1 RAX2 RAX3,triple_knockout,,,,WT,Shoot_Branching,decreased,strong,,,,,,"In the Arabidopsis rax1 rax2 rax3 triple mutant, almost no axillary meristems were able to initiate",,,,
T096,GR24 on d14,knockout_plus_GR24,,,,mutant,Shoot_Branching,unchanged,strong,,,,,,GR24 had no effect on d14-1,,,,
T097,SMXL6 SMXL7 SMXL8 (in max2 background),quadruple_knockout,,,,WT,Shoot_Branching,unchanged,moderate,,,,,,Restores max2 branching to wild type,,,,
T098,SMXL6 SMXL7 SMXL8 MAX2 BRC1,quintuple_knockout,,,,WT,Shoot_Branching,increased,strong,,,,,,Branching level of smxl678 max2-1 brc1 up to that of brc1,,,,
T099,SMXL7 MAX2,double_knockout,,,,WT,Shoot_Branching,increased,moderate,,,,,,Reduced branch numbers compared to max2 alone,,,,
T100,FHY3 FAR1,double_knockout,,,,WT,Shoot_Branching,decreased,strong,,,,,,fhy3 far1 plants had only 13.4% of WT branches,,,,
T101,CUC2,overexpression,,,,WT,Shoot_Branching,increased,moderate,,,,,,Overexpression of these genes led to ectopic axillary meristem formation,,,,
T102,YUC1D MAX3,double_mutant,,,,WT,Shoot_Branching,increased,strong,,,,,,Double mutant combination appeared identical to max3 single mutants,,,,
T103,Brassinolide,treatment,,,,WT,Shoot_Branching,unchanged,moderate,,,,,,BR treatments had no effects on BRC1 expression,,,,
T104,BRI1 (bri1-301),loss_of_function,,,,WT,Shoot_Branching,unchanged,moderate,,,,,,Mutants of BR signaling components did not alter branch number,,,,
T105,GAI (gai-1 dominant negative),gain_of_function,,,,WT,Shoot_Branching,unchanged,moderate,,,,,,No significant difference in total branches for gai-1,,,,
T106,DLK2,knockout,,,,WT,Shoot_Branching,unchanged,moderate,,,,,,dlk2-3 mutant largely indistinguishable from wild type,,,,
T107,PIN1 MAX2,double_knockout,,,,WT,Shoot_Branching,decreased,strong,,,,,,Reduced branching in pin1 max2 double mutant,,,,
T108,SMXL7 SMXL8 MAX2,triple_knockout,,,,WT,Shoot_Branching,unchanged,moderate,,,,,,Rosette branching restored to wild type levels in smxl7 smxl8 max2,,,,
T109,PHYA,knockout,,,,WT,Shoot_Branching,unchanged,moderate,,,,,,phyA results similar to wild type,,,,
T110,MAX4 TIR3,double_knockout,,,,WT,Shoot_Branching,increased,strong,,,,,,"In max4 tir3, branching was high",,,,
T111,MAX2 TIR3,double_knockout,,,,WT,Shoot_Branching,increased,strong,,,,,,Double mutants between these two classes had at least partially additive phenotypes,,,,
T112,PHYB MAX4,double_knockout,,,,WT,Shoot_Branching,increased,moderate,,,,,,Branch lengths increased by phyB deficiency in max4,,,,
T113,PHYB AXR1,double_knockout,,,,WT,Shoot_Branching,increased,moderate,,,,,,Branch lengths increased by phyB deficiency in axr1-12,,,,
T114,BRC2,overexpression,,,,WT,Shoot_Branching,unchanged,moderate,,,,,,Plants expressing GFP:BRC2 did not show any obvious phenotypic effect,,,,
T115,FHY3 FAR1 SPL9 SPL15,quadruple_knockout,,,,WT,Shoot_Branching,increased,moderate,,,,,,fhy3 far1/spl9 spl15 had similar number as spl9 spl15 double mutant (SPL epistatic),,,,
T116,GR24,knockout,,,,mutant,Shoot_Branching,decreased,moderate,,,,,,repeated application of GR24...completely inhibited bud outgrowth.,,,, | Cross-species: GR24/Decapitated WT pea + GR24 (2 u
T117,ccd8,knockout,,,,mutant,Shoot_Branching,decreased,moderate,,,,,,ccd8 mutant + GR24 inhibited bud growth from outset.,,,, | Cross-species: ccd8/ccd8 (rms1) KO + GR24
T118,GR24,knockout,,,,mutant,Shoot_Branching,decreased,moderate,,,,,,axr1 mutant + GR24 47% reduction in branch number.,,,,
T119,GR24,knockout,,,,mutant,Shoot_Branching,decreased,moderate,,,,,,tir1 afb1 afb2 afb3 quadruple + GR24 inhibited shoot bud outgrowth.,,,,
T120,brc1,knockout,,,,mutant,Shoot_Branching,unchanged,moderate,,,,,,brc1 mutant...was not reduced by GR24.,,,,
T121,auxin,overexpression,,,,WT,Shoot_Branching,decreased,moderate,,,,,,Branching was significantly suppressed in yuc1D compared with wild type.,,,,
T122,max3,knockout,,,,WT,Shoot_Branching,increased,moderate,,,,,,yuc1D x max3 highly branched phenotype (max3-like).,,,,
T123,unknown,knockout,,,,WT,Shoot_Branching,increased,moderate,,,,,,Wild-type + NPA increased branching below treatment site.,,,,
T124,GR24,knockout,,,,mutant,Shoot_Branching,decreased,moderate,,,,,,GR24 + NPA caused ~50% inhibition of bud outgrowth despite NPA blocking transport.,,,,
T125,max1,knockout,,,,WT,Shoot_Branching,increased,moderate,,,,,,"max1-1/max4-1 vascular regeneration faster than WT, more abundant vasculature.",,,,
T126,max2,knockout,,,,WT,Shoot_Branching,increased,moderate,,,,,,regeneration occurred faster...and the regenerated strands were more abundant in max2-3.,,,,
T127,d14,knockout,,,,mutant,Shoot_Branching,unchanged,moderate,,,,,,d14-1 htl-3 less sensitivity to GR24 antagonism of NAA effect.,,,,
T128,smxl678,knockout,,,,WT,Shoot_Branching,increased,moderate,,,,,,smxl678 max2 mutant...has a sprawling growth habit with increased branching.,,,,
T129,smxl7,knockout,,,,WT,Shoot_Branching,unchanged,moderate,,,,,,loss of SMXL7 function...is sufficient to suppress completely the SL-related shoot branching.,,,,
T130,Psbrc1,knockout,,,,WT,Shoot_Branching,increased,moderate,,,,,,The pea Psbrc1 mutant displays an increased shoot-branching phenotype.,,,, | Cross-species: Psbrc1/Psbrc1 single KO
T131,Psbrc1,knockout,,,,mutant,Shoot_Branching,unchanged,moderate,,,,,,Psbrc1 mutant does not respond to strigolactone application.,,,, | Cross-species: Psbrc1/Psbrc1 KO + GR24
T132,GR24,knockout,,,,mutant,Shoot_Branching,decreased,moderate,,,,,,transcriptionally up-regulated by direct application of the synthetic SL GR24.,,,,
T133,cytokinin,knockout,,,,mutant,Shoot_Branching,decreased,moderate,,,,,,down-regulated by the cytokinin (CK) 6-benzylaminopurine.,,,,
T134,d53,overexpression,,,,WT,Shoot_Branching,increased,moderate,,,,,,"dominant form of D53 is resistant to SL-mediated degradation, causing high-tillering phenotype.",,,, | Cross-species: d53/d53 dominant gain-of-function 
T135,d14,knockout,,,,WT,Shoot_Branching,increased,moderate,,,,,,"D53 not degraded in d14 mutant, blocks SL signaling.",,,, | Cross-species: d14/d14 KO (rice)
T136,unknown,knockout,,,,WT,Shoot_Branching,increased,moderate,,,,,,D53 not degraded in d3 mutant; blocks SL signaling.,,,, | Cross-species: unknown/d3 KO (rice)
T137,Atd14,knockout,,,,WT,Shoot_Branching,increased,moderate,,,,,,Atd14-1 has an increased branching phenotype similar to max2.,,,,
T138,unknown,knockout,,,,WT,Shoot_Branching,unchanged,moderate,,,,,,kai2 has a branching pattern that is indistinguishable from wild type.,,,,
T139,Atd14,knockout,,,,mutant,Shoot_Branching,unchanged,moderate,,,,,,Atd14-1 strigolactone-insensitive.,,,,
T140,unknown,knockout,,,,WT,Shoot_Branching,increased,moderate,,,,,,"smax1 smxl2 seedlings were resistant to mannitol, showing only 10% reduction.",,,,
T141,d14,knockout,,,,WT,Shoot_Branching,increased,moderate,,,,,,Growth inhibition by mannitol was enhanced in d14 seedlings.,,,,
T142,max3,knockout,,,,WT,Shoot_Branching,increased,moderate,,,,,,degradation...not in...SL-deficient max3 seedlings.,,,,
T143,max1,knockout,,,,WT,Shoot_Branching,increased,moderate,,,,,,"max1-1: 12,012 genes (6,462 up, 5,550 down).",,,,
T144,max2,knockout,,,,WT,Shoot_Branching,increased,moderate,,,,,,"High branched phenotype of the max mutant can be rescued by application of GR24, except for the max2 phenotype.",,,,
T145,max3,knockout,,,,mutant,Shoot_Branching,decreased,moderate,,,,,,"max mutant rescued by GR24, except for max2.",,,,
T146,max4,knockout,,,,mutant,Shoot_Branching,decreased,moderate,,,,,,"max mutant rescued by GR24, except for max2.",,,,
T147,unknown,knockout,,,,WT,Shoot_Branching,increased,moderate,,,,,,The smxl4 smxl5 mutant has enhanced responses to strigolactone,,,,
T148,unknown,knockout,,,,WT,Shoot_Branching,decreased,moderate,,,,,,The smxl4 smxl5 mutant has enhanced responses to strigolactone,,,,
T149,unknown,knockout,,,,WT,Shoot_Branching,decreased,moderate,,,,,,induction requires the SWI/SNF ATPase SPLAYED (SYD),,,,
T150,unknown,knockout,,,,WT,Shoot_Branching,increased,moderate,,,,,,sucrose antagonizes the suppressive action of SL on tillering,,,,
T151,unknown,knockout,,,,WT,Shoot_Branching,increased,moderate,,,,,,SL-biosynthesis (max1-1) and SL-insensitive (atd14-1) mutants showed altered responses to nitrogen deficient,,,,
T152,unknown,knockout,,,,WT,Shoot_Branching,decreased,moderate,,,,,,smxl6/7/8 triple mutants showed markedly enhanced drought tolerance,,,,
T153,unknown,knockout,,,,WT,Shoot_Branching,increased,moderate,,,,,,"The pea rms2 mutants display increased shoot branching, particularly at basal nodes",,,,
T154,unknown,knockout,,,,WT,Shoot_Branching,decreased,moderate,,,,,,Auxin application to the decapitated stump or to intact plants results in an increase in transcript abundance of CCD7 (RMS5) and CCD8 (RMS1),,,,
T155,unknown,knockout,,,,WT,Shoot_Branching,decreased,moderate,,,,,,"SMXL7pro::SMXL7 rescued the rosette axillary branching and shoot height phenotypes of max3 smxl6,7,8",,,,
T156,unknown,knockout,,,,WT,Shoot_Branching,unchanged,moderate,,,,,,"SMXL7pro::SMXLchi711 restored the axillary branching of max3 smxl6,7,8 plants to the level of max3",,,,
T157,TIE2,knockout,,,,WT,Shoot_Branching,decreased,slight,,,,,,TIE1 and TIE2 redundantly repress BRC1 in axillary buds; tie2 single shows mild branching reduction in CK-treated conditions,,,,
T158,ARR1 ARR2,double_knockout,,,,WT,Shoot_Branching,decreased,moderate,,,,,,ARR1 and ARR2 are required for cytokinin-induced TIE1 expression; arr1 arr2 mutants have impaired CK signaling and reduced branching response to CK,,,,
T159,miR156,overexpression,,,,WT,Shoot_Branching,increased,moderate,,,,,,"Overexpression of miR156 represses SPL9/SPL15, prolongs juvenility, and increases branching (consistent with reduced SPL->BRC1 activation)",,,,
T160,DRM1,knockout,,,,WT,Shoot_Branching,increased,slight,,,,,,DRM1 is a marker of bud dormancy; loss-of-function plants are reported to show modestly enhanced bud outgrowth (Rae et al. 2013 reviewed in this paper),,,,
T161,NCED5,knockout,,,,WT,Shoot_Branching,increased,slight,,,,,,the nced3 nced5 mutant produced a clear increase in the final number of fruits compared to wild-type,,,,
T162,NCED3 NCED5,double_knockout,,,,WT,Shoot_Branching,increased,moderate,,,,,,the nced3 nced5 mutant produced a clear increase in the final number of fruits compared to wild-type control plants,,,,
T163,TIE1 BRC1,double_knockout,,,,WT,Shoot_Branching,increased,strong,,,,,,"tie1 brc1 double mutant shows enhanced branching, consistent with TIE1 acting upstream of BRC1; brc1 epistatic in some contexts",,,,
T164,unknown,knockout,,,,WT,Shoot_Branching,increased,moderate,,,,,,max primary stems exhibit increased capacity for auxin transport with elevated PIN auxin efflux facilitators.,,,,
T165,unknown,knockout,,,,WT,Shoot_Branching,increased,moderate,,,,,,max primary stems exhibit increased capacity for auxin transport,,,,
T166,unknown,knockout,,,,WT,Shoot_Branching,increased,moderate,,,,,,highly branched mutant phenotype; both buds activated on all explants,,,,
T167,unknown,knockout,,,,WT,Shoot_Branching,decreased,moderate,,,,,,phyB produced fewer branches than the wild type,,,,
T168,unknown,knockout,,,,WT,Shoot_Branching,increased,moderate,,,,,,elevated expression of the branching repressor BRANCHED1 in the axillary buds,,,,
T169,unknown,knockout,,,,WT,Shoot_Branching,decreased,moderate,,,,,,phyB bud outgrowth was more sensitive than the wild type to auxin,,,,
T170,unknown,knockout,,,,WT,Shoot_Branching,increased,moderate,,,,,,BRC1 expression suppressed within 3 hours of increased R:FR,,,,
T171,unknown,knockout,,,,WT,Shoot_Branching,increased,moderate,,,,,,"increased R:FR reduces bud ABA within 3 hours, prior to growth changes",,,,
